{
  "source_url": null,
  "parsed_at": "2025-12-10T15:29:43.890323",
  "company": "Handelsbanken",
  "role": "Head of Digital",
  "location": "London, England, United Kingdom",
  "job_type": null,
  "requirements": {
    "technical_skills": [
      "agile",
      "compliance",
      "leadership",
      "management",
      "risk management"
    ],
    "experience_level": [
      "head",
      "lead",
      "senior"
    ],
    "education": [
      "business"
    ],
    "soft_skills": [
      "influencing",
      "leadership",
      "stakeholder"
    ],
    "domain_knowledge": [
      "banking",
      "compliance",
      "risk management"
    ],
    "responsibilities": [],
    "keywords": []
  },
  "raw_text": "Head of Digital at Handelsbanken\n\nLocation: London, England, United Kingdom\nEmployment Type: Full-time\nSeniority Level: Executive\nIndustry: Banking\n\nKey Responsibilities:\n- Leading Handelsbanken's digital product practice with oversight of design, development and ongoing management of digital channels, CRM, onboarding, credit and modern workplace platforms\n- Translating the Bank's growth ambitions into product vision and prioritized roadmaps\n- Leading delivery workstreams for CRM, onboarding, web/apps, credit, and modern workplace\n- Championing the Digital Product Community of Practice\n- Embedding agile methodologies across product teams\n- Managing dependencies, risks, and governance frameworks\n- Building relationships with business, risk, compliance, and technology teams\n- Co-leading teams with Technology counterpart (Dual Key responsibility)\n- Leading, coaching, and developing the Digital Product team\n- Promoting adherence to Risk Management Framework\n\nIdeal Candidate Requirements:\n- Strong ability to interpret strategy and translate into outcome-focused product decisions\n- Experience delivering large-scale transformation across technology and business\n- Hands-on experience with Agile methodologies in regulated environments\n- Proven leadership of Product communities and Communities of Practice\n- Experience establishing governance for high-profile initiatives\n- Demonstrated organizational capability for large, complex programs\n- Effective influencing and stakeholder engagement skills\n- Resilience and solution-focused approach under pressure\n\nCompany Information:\nHandelsbanken is a relationship bank with a decentralised way of working emphasizing local branch autonomy and individual customer focus rather than product-driven sales. The organization values trust in and respect for each individual and long-term employee development.\n\nBenefits:\n- Competitive salary\n- Private medical insurance, income protection, life assurance\n- Market-leading 15% pension contribution\n- Extensive learning and development opportunities\n",
  "word_count": 259
}